{
  "schema_version": 1,
  "scenario_id": "consumer-offset-beyond-kafka-retention",
  "runner_run_id": "0ae85dd4-c740-4e31-aab6-b8c650c95b54",
  "rebuild_required_observed_before_rebuild": true,
  "commands": [
    {
      "sequence": 1,
      "kind": "CONTROL",
      "target": "m6-real-fault",
      "method": "DELETE",
      "path": "/scenario/consumer-offset-beyond-kafka-retention/fault",
      "started_at": "2026-07-30T03:40:30Z",
      "finished_at": "2026-07-30T03:40:36Z",
      "exit_code": 0
    }
  ],
  "cleanup_actions": [
    {
      "name": "dispatch-owned-m6-real-fault",
      "success": true,
      "finished_at": "2026-07-30T03:40:36Z"
    }
  ],
  "cleanup_failures": 0
}
