{"schema_version":1,"scenario_id":"canal-outage-beyond-binlog-retention","runner_run_id":"11111111-1111-4111-8111-111111111111","rebuild_required_observed_before_rebuild":true,"commands":[{"sequence":1,"kind":"CONTROL","target":"m6-real-fault","method":"DELETE","path":"/scenario/canal-outage-beyond-binlog-retention/fault","started_at":"2026-07-28T20:01:00Z","finished_at":"2026-07-28T20:01:01Z","exit_code":0}],"cleanup_actions":[{"name":"fixture-cleanup","success":true,"finished_at":"2026-07-28T20:02:00Z"}],"cleanup_failures":0}
