{
  "schema_version": 1,
  "scenario_id": "consumer-crash-after-elasticsearch-before-offset",
  "runner_run_id": "b858d800-13d0-457c-bdc4-ee5a732a6202",
  "rebuild_required_observed_before_rebuild": false,
  "commands": [
    {
      "sequence": 1,
      "kind": "CONTROL",
      "target": "m6-real-fault",
      "method": "DELETE",
      "path": "/scenario/consumer-crash-after-elasticsearch-before-offset/fault",
      "started_at": "2026-07-30T03:47:27Z",
      "finished_at": "2026-07-30T03:47:53Z",
      "exit_code": 0
    }
  ],
  "cleanup_actions": [
    {
      "name": "dispatch-owned-m6-real-fault",
      "success": true,
      "finished_at": "2026-07-30T03:47:53Z"
    }
  ],
  "cleanup_failures": 0
}
