{
  "schema_version": 1,
  "scenario_id": "category-rename-multi-product",
  "runner_run_id": "2c829536-3b4b-45e2-98c6-4f1e7ae928df",
  "rebuild_required_observed_before_rebuild": false,
  "commands": [
    {
      "sequence": 1,
      "kind": "CONTROL",
      "target": "m6-real-fault",
      "method": "DELETE",
      "path": "/scenario/category-rename-multi-product/fault",
      "started_at": "2026-07-29T20:03:54Z",
      "finished_at": "2026-07-29T20:04:02Z",
      "exit_code": 0
    }
  ],
  "cleanup_actions": [
    {
      "name": "dispatch-owned-m6-real-fault",
      "success": true,
      "finished_at": "2026-07-29T20:04:02Z"
    }
  ],
  "cleanup_failures": 0
}
