{
  "schema_version": 1,
  "scenario_id": "manual-elasticsearch-drift",
  "runner_run_id": "79acce96-934d-4b14-a7b1-53511fa10240",
  "rebuild_required_observed_before_rebuild": false,
  "commands": [
    {
      "sequence": 1,
      "kind": "CONTROL",
      "target": "m6-real-fault",
      "method": "DELETE",
      "path": "/scenario/manual-elasticsearch-drift/fault",
      "started_at": "2026-07-30T03:59:47Z",
      "finished_at": "2026-07-30T03:59:47Z",
      "exit_code": 0
    }
  ],
  "cleanup_actions": [
    {
      "name": "dispatch-owned-m6-real-fault",
      "success": true,
      "finished_at": "2026-07-30T03:59:47Z"
    }
  ],
  "cleanup_failures": 0
}
