{
  "schema_version": 1,
  "scenario_id": "rebuild-with-concurrent-writes",
  "runner_run_id": "9b004fba-f1b8-401c-9caf-e9c4dc3f9688",
  "rebuild_required_observed_before_rebuild": true,
  "commands": [
    {
      "sequence": 1,
      "kind": "CONTROL",
      "target": "m6-real-fault",
      "method": "DELETE",
      "path": "/scenario/rebuild-with-concurrent-writes/fault",
      "started_at": "2026-07-30T04:07:54Z",
      "finished_at": "2026-07-30T04:07:57Z",
      "exit_code": 0
    }
  ],
  "cleanup_actions": [
    {
      "name": "dispatch-owned-m6-real-fault",
      "success": true,
      "finished_at": "2026-07-30T04:07:57Z"
    }
  ],
  "cleanup_failures": 0
}
