{
  "schema_version": 1,
  "scenario_id": "kafka-temporary-unavailable",
  "runner_run_id": "c193d60a-9dc7-40da-b588-9935741e6930",
  "rebuild_required_observed_before_rebuild": false,
  "commands": [
    {
      "sequence": 1,
      "kind": "CONTROL",
      "target": "m6-real-fault",
      "method": "DELETE",
      "path": "/scenario/kafka-temporary-unavailable/fault",
      "started_at": "2026-07-30T03:37:13Z",
      "finished_at": "2026-07-30T03:37:17Z",
      "exit_code": 0
    }
  ],
  "cleanup_actions": [
    {
      "name": "dispatch-owned-m6-real-fault",
      "success": true,
      "finished_at": "2026-07-30T03:37:17Z"
    }
  ],
  "cleanup_failures": 0
}
