{
  "schema_version": 1,
  "scenario_id": "late-old-revision",
  "runner_run_id": "6667132c-78f4-48a3-93be-0f6890f5a8ef",
  "rebuild_required_observed_before_rebuild": false,
  "commands": [
    {
      "sequence": 1,
      "kind": "CONTROL",
      "target": "m6-real-fault",
      "method": "DELETE",
      "path": "/scenario/late-old-revision/fault",
      "started_at": "2026-07-30T03:55:50Z",
      "finished_at": "2026-07-30T03:55:50Z",
      "exit_code": 0
    }
  ],
  "cleanup_actions": [
    {
      "name": "dispatch-owned-m6-real-fault",
      "success": true,
      "finished_at": "2026-07-30T03:55:50Z"
    }
  ],
  "cleanup_failures": 0
}
