{
  "schema_version": 1,
  "scenario_id": "consumer-crash-before-elasticsearch",
  "runner_run_id": "f888a171-d079-4464-bab2-f0801d7d165f",
  "rebuild_required_observed_before_rebuild": false,
  "commands": [
    {
      "sequence": 1,
      "kind": "CONTROL",
      "target": "m6-real-fault",
      "method": "DELETE",
      "path": "/scenario/consumer-crash-before-elasticsearch/fault",
      "started_at": "2026-07-30T03:42:58Z",
      "finished_at": "2026-07-30T03:43:30Z",
      "exit_code": 0
    }
  ],
  "cleanup_actions": [
    {
      "name": "dispatch-owned-m6-real-fault",
      "success": true,
      "finished_at": "2026-07-30T03:43:30Z"
    }
  ],
  "cleanup_failures": 0
}
