{
  "schema_version": 1,
  "scenario_id": "canal-outage-beyond-binlog-retention",
  "runner_run_id": "3075cc0e-29df-437b-8ed8-990eee6856e9",
  "rebuild_required_observed_before_rebuild": true,
  "commands": [
    {
      "sequence": 1,
      "kind": "CONTROL",
      "target": "m6-real-fault",
      "method": "DELETE",
      "path": "/scenario/canal-outage-beyond-binlog-retention/fault",
      "started_at": "2026-07-29T19:47:25Z",
      "finished_at": "2026-07-29T19:48:44Z",
      "exit_code": 0
    }
  ],
  "cleanup_actions": [
    {
      "name": "dispatch-owned-m6-real-fault",
      "success": true,
      "finished_at": "2026-07-29T19:48:44Z"
    }
  ],
  "cleanup_failures": 0
}
