{
  "schema_version": 1,
  "scenario_id": "consumer-systematic-mapping-bug",
  "runner_run_id": "882940aa-e5a4-43b6-85c3-4fbdec3dd428",
  "rebuild_required_observed_before_rebuild": false,
  "commands": [
    {
      "sequence": 1,
      "kind": "CONTROL",
      "target": "m6-real-fault",
      "method": "DELETE",
      "path": "/scenario/consumer-systematic-mapping-bug/fault",
      "started_at": "2026-07-30T04:13:18Z",
      "finished_at": "2026-07-30T04:13:18Z",
      "exit_code": 0
    }
  ],
  "cleanup_actions": [
    {
      "name": "dispatch-owned-m6-real-fault",
      "success": true,
      "finished_at": "2026-07-30T04:13:18Z"
    }
  ],
  "cleanup_failures": 0
}
